book_num,paragraph
0,hagrid look explode dursley boom uncle vernon go pale whisper something sound like mimblewimble hagrid stare wildly harry but yeh must know yer mom dad say I mean famous
0,they could hear footstep filch run fast could toward peeve shout oh move hermione snarl she grab harry wand tap lock whisper alohomora the lock click door swung open pile shut quickly press ear listen which way go peeve filch say
0,seamus get impatient prod wand set fire harry put hat ron next table much luck wingardium leviosa shout wave long arm like windmill you say wrong harry hear hermione snap it winggardium leviosa make gar nice long
0,wingardium leviosa shout wave long arm like windmill you say wrong harry hear hermione snap it winggardium leviosa make gar nice long you clever ron snarl hermione roll sleeve gown flick wand say wingardium leviosa
0,it winggardium leviosa make gar nice long you clever ron snarl hermione roll sleeve gown flick wand say wingardium leviosa their feather rise desk hover four foot head oh well do cry professor flitwick clapping
0,the troll feel harry hang even troll notice stick long bit wood nose harry wand still hand jump go straight one troll nostril howl pain troll twist flail club harry cling dear life second troll go rip catch terrible blow club hermione sunk floor fright ron pull wand know go hear cry first spell come head wingardium leviosa the club fly suddenly troll hand rise high high air turn slowly drop sicken crack onto owner head the troll sway spot fall flat face thud make whole room tremble
0,little harry know ron hermione secretly practice leglocker curse they get idea malfoy use neville ready use snape show sign want hurt harry now forget locomotor mortis hermione mutter ron slip wand sleeve I know ron snap don nag
0,neville say I really really sorry she raise wand petrificus totalus cry point neville neville arm snap side his leg spring together
0,he pull handle lock the two follow they tug heave door budge even hermione try alohomora charm now say ron these birdsthey decoration say hermione
1,they grab ink bottle spray class shred book paper tear picture wall upend waste basket grab bag book throw smash window within minute half class shelter desk neville swinge iron chandelier ceiling come round round pixie lockhart shout he roll sleeve brandish wand bellow peskipiksi pesternomi it absolutely effect one pixie seize wand throw window lockhart gulped dive desk narrowly avoid squashed neville fall second later chandelier give way
1,I bet harry murmur watch snape baring tooth one two three both swung wand head point opponent snape cry expelliarmus there dazzle flash scarlet light lockhart blast foot he fly backward stage smash wall slide sprawl floor malfoy slytherin cheer hermione dancing tiptoe
1,when I count three cast charm disarm opponent disarm want accident one two three harry swung wand high malfoy already start two his spell hit harry hard feel though hit head saucepan he stumble everything still seem work waste time harry pointed wand straight malfoy shout rictusempra a jet silver light hit malfoy stomach double wheezing I say disarm lockhart shout alarm head battle crowd malfoy sank knee harry hit tickling charm could barely move laugh
1,a jet silver light hit malfoy stomach double wheezing I say disarm lockhart shout alarm head battle crowd malfoy sank knee harry hit tickling charm could barely move laugh harry hang back vague feeling would unsporte bewitch malfoy floor mistake gasp breath malfoy point wand harry knee choke tarantallegra next second harry leg begin jerk around control kind quickstep stop stop scream lockhart snape take charge
1,stop stop scream lockhart snape take charge finite incantatem shout harry foot stop dance malfoy stop laugh able look a haze greenish smoke hover scene both neville justin lie floor pant ron hold ashenface seamus apologize whatever broken wand do hermione millicent bulstrode still move millicent hermione headlock hermione whimpering pain wand lie forget floor
1,but lockhart listen three two one go shout malfoy raise wand quickly bellow serpensortia the end wand explode harry watch aghast long black snake shot fall heavily onto floor raise ready strike
1,but hermione pull wand bag it might invisible ink whisper she tap diary three time say aparecium nothing happen undaunted hermione shove hand back bag pull appear bright red eraser
1,when I look say malfoy wave diary tauntingly harry percy say as school prefect harry lost temper he pull wand shout expelliarmus snape disarm lockhart malfoy find diary shoot hand air ron grinning broadly catch harry say percy loudly
1,there would need pitchdark forest c mon fang go walk say harry pat leg fang bound happily house behind dash edge forest lift leg large sycamore tree harry take wand murmur lumos tiny light appear end enough let watch path sign spider good thinking say ron I light mine know probably blow something
1,I never sell another book harry reach wand time lockhart barely raise harry bellow expelliarmus lockhart blast backward fall trunk wand fly high air ron catch fling open window shouldn let professor snape teach we one say harry furiously kick lockhart trunk aside
1,under lake probably say ron squint around dark slimy wall all three turn stare darkness ahead lumos harry muttered wand lit c mon say ron lockhart go footstep slap loudly wet floor the tunnel dark could see little distance ahead
1,the adventure end boy say I shall take bit skin back school tell I late save girl two tragically lose mind sight mangle body say goodbye memory he raise ron spellotape wand high head yell obliviate the wand explode force small bomb harry flung arms head run slip coil snake skin way great chunk tunnel ceiling thunder floor
2,harry squint black alleyway if would move know whether stray cat something else lumos harry muttered light appear end wand almost dazzle he hold high head pebbledashe wall number two suddenly sparkle garage door gleam harry saw quite distinctly hulk outline something big wide gleam eye harry step backwards
2,most em know wiv youknow oo go come quiet but sirius black I eard think e secondincommand youknow oo ad take anyway cornered black middle street full muggle black take wand e blast alf street apart wizard get dozen muggle get way orrible eh
2,I blow meself I set foot place serve right mind they ad job coverin din ern stan say ole street blow muggle dead what say ad appene ern
2,they ad job coverin din ern stan say ole street blow muggle dead what say ad appene ern gas explosion grunt ernie an e say stan examine newspaper picture black gaunt face
2,ear arry potter blow aunt we ad I m ere knight bus di n ern e tryin run he harry broken wizard law like sirius black
2,this useful little spell tell class shoulder please watch closely he raise wand shoulder height say waddiwasi point peeve with force bullet wad chew gum shoot keyhole straight peeve leave nostril whirl right way zoom away curse cool sir say dean thomas amazement
2,what need force assume shape find amusing we practise charm without wand first after please riddikulus riddikulus say class together good say professor lupin
2,we practise charm without wand first after please riddikulus riddikulus say class together good say professor lupin very good
2,yes say neville uncertainly plainly wonder come next when boggart burst wardrobe neville see assume form professor snape say lupin and raise wand thus cry riddikulus concentrate hard grandmother clothe if go well professor boggart snape force vulturetoppe hat green dress big red handbag there great shout laughter
2,snape round there another crack stand bloodstaine bandage mummy sightless face turn parvati begin walk towards slowly drag foot stiff arm rise riddikulus cry parvati a bandage unravel mummy foot become entangle fall face forwards head roll seamus roar professor lupin
2,where mummy woman floorlength black hair skeletal greentinged face banshee she open mouth wide unearthly sound fill room long wail shriek make hair harry head stand end riddikulus shout seamus the banshee make rasp noise clutch throat voice go crack
2,crack the eyeball become sever hand flipped begin creep along floor like crab riddikulu yelled dean there snap hand trap mousetrap excellent
2,for moment harry think ron frozen then riddikulus bellow ron spider leg vanish it roll lavender brown squealed run way come halt harry foot he raise wand ready
2,the legless spider vanish for second everyone look wildly around see then see silverywhite orb hang air front lupin say riddikulus almost lazily crack forward neville finish say lupin boggart land floor cockroach
2,snape back this time neville charge forward look determined riddikulus shout split second view snape lacy dress neville let great ha laughter boggart explode burst thousand tiny wisp smoke go excellent cry professor lupin class break applause excellent neville
2,I idea harry give glass quick he hand team watch amazement hermione tap wand say impervius there say hand back harry they repel water
2,he look back map the tiny speech bubble appear next figure the word inside say dissendium dissendium harry whisper tap stone witch at statue hump open wide enough admit fairly thin person
2,the tiny speech bubble appear next figure the word inside say dissendium dissendium harry whisper tap stone witch at statue hump open wide enough admit fairly thin person harry glance quickly corridor tuck map away hoisted hole headfirst push forwards
2,he stand look around it pitch dark he hold wand mutter lumos see narrow low earthy passageway he raise map tap tip wand mutter mischief manage the map go blank he fold carefully tuck inside robe heart beat fast excited apprehensive set
2,in instant ron hermione place hand top harry head force stool table drip butterbeer crouch sight harry clutch empty tankard watch teacher fudge foot move towards bar pause turn walk right towards somewhere hermione whisper mobiliarbus the christmas tree beside table rise inch ground drift sideways land soft thump right front table hiding view stare dense low branch harry see four set chair leg move back table right beside hear grunt sigh teacher minister sit
2,finally settle moment first ridden broomstick right say try recall exactly possible wonderful soar sensation stomach the incantation lupin clear throat expecto patronum expecto patronum harry repeat breath expecto patronum concentrate hard happy memory
2,right say try recall exactly possible wonderful soar sensation stomach the incantation lupin clear throat expecto patronum expecto patronum harry repeat breath expecto patronum concentrate hard happy memory oh yeah say harry quickly force thought back first broomride
2,concentrate hard happy memory oh yeah say harry quickly force thought back first broomride expecto patrono patronum sorry expecto patronum expecto patronum something whoosh suddenly end wand look like wisp silvery gas do see say harry excitedly
2,the dementor step box start sweep silently towards harry draw deep rattle breath a wave pierce cold break expecto patronum harry yelled expecto patronum expecto
2,a wave pierce cold break expecto patronum harry yelled expecto patronum expecto but classroom dementor dissolve harry fall thick white fog mother voice louder ever echo inside head not harry
2,expecto patronum harry yelled expecto patronum expecto but classroom dementor dissolve harry fall thick white fog mother voice louder ever echo inside head not harry not harry
2,the room go icily cold dark the dementor glide forward draw rattly breath one rot hand extend towards harry expecto patronum harry yelled expecto patronum expecto pat
2,the dementor glide forward draw rattly breath one rot hand extend towards harry expecto patronum harry yelled expecto patronum expecto pat white fog obscure sense big blurred shape move around come new voice man voice shout panic
2,expecto patronum harry yelled expecto patronum expecto pat white fog obscure sense big blurred shape move around come new voice man voice shout panic lily take harry go
2,all right go he pull lid case third time dementor rise room fall cold dark expecto patronum harry bellow expecto patronum expecto patronum
2,he pull lid case third time dementor rise room fall cold dark expecto patronum harry bellow expecto patronum expecto patronum the screaming inside harry head start except time sound though come badly tune radio
2,expecto patronum harry bellow expecto patronum expecto patronum the screaming inside harry head start except time sound though come badly tune radio soft louder soft could still see dementor halt huge silver shadow came burst end harry wand hover dementor though harry leg feel like water still feet though much long sure
2,the screaming inside harry head start except time sound though come badly tune radio soft louder soft could still see dementor halt huge silver shadow came burst end harry wand hover dementor though harry leg feel like water still feet though much long sure riddikulus roar lupin spring forwards there loud crack harry cloudy patronus vanish along dementor sank chair feel exhaust run mile leg shake out corner eye see professor lupin force boggart back packing case wand turn silvery orb
2,what matter say ron harry pointed ron pulled wand mutter lumos a beam light fall across grass hit bottom tree illuminate branch crouch amongst bud leave crookshank get ron roar stooped seize stone lie grass could anything else crookshank vanish one swish long ginger tail
2,three dementor three tall black hooded dementor look he stop think plunge hand neck robe whip wand roar expecto patronum something silver white something enormous erupted end wand he know shoot directly dementor pause watch mind still miraculously clear look ahead nearly
2,harry squint the minuscule writing next read neville longbottom harry quickly pull wand mutter dissendium shove bag statue could climb neville come around corner harry I forget go hogsmeade either
2,that true say hermione get foot if see open witch hump you tap say dissendium say harry but hermione wait rest sentence strode across room push fat lady portrait open vanish sight
2,he hear hermione shriek pain fall harry grope wand blink blood eye lumo whisper the wandlight show trunk thick tree chase scabber shadow whomp willow branch creak though high wind whip backwards forward stop go near and base trunk dog drag ron backwards large gap root ron fight furiously head torso slip sight
2,everything cover thick layer dust except floor wide shiny stripe make something drag upstairs they reach dark landing nox whisper together light end wand go only one door open as creep towards hear movement behind low moan deep loud purr
2,harry trap what he dog animagus ron stare harry shoulder harry wheel around
2,his yellow tooth bare grin it sirius black expelliarmus croak point ron wand harry hermione wand shoot hand high air black catch then take step close
2,the door room burst open shower red spark harry wheel around professor lupin came hurtle room face bloodless wand raise ready his eye flicker ron lie floor hermione cower next door harry standing wand cover black black crumple bleed harry foot expelliarmus lupin shout harry wand fly hand two hermione hold lupin catch deftly move room stare black still crookshank lie protectively across chest
2,no say lupin quietly he wizard an animagus say black name peter pettigrew harry potter and the prisoner azkaban chapter eighteen
2,but professor lupin scabber pettigrew true know why true lupin say calmly though class hermione simply spot problem experiment grindylow because people would know peter pettigrew animagus we animagi class professor mcgonagall and I look I homework ministry keep tabs witch wizard become animal register show animal become marking thing I go look professor mcgonagall register seven animagi century pettigrew name list
2,yes indeed say lupin it take good part three year work your father sirius clever student school lucky animagus transformation go horribly wrong one reason ministry keep close watch attempt peter need help could get james sirius finally fifth year manage
2,and I change lupin face harden selfdigust voice all year I battle wonder whether I tell dumbledore sirius animagus but I why
2,it would meant admit I betray trust I school admit I lead other along dumbledore trust mean everything he let hogwart boy give job I shun adult life unable find pay work I and I convince sirius get school use dark art learn voldemort animagus nothing way snape right along snape say black harshly take eye scabber first time minute look lupin what snape get
2,harry make mind split second before snape could take even one step towards raise wand expelliarmus yell except voice shout there blast make door rattle hinge snape lift foot slam wall slide floor trickle blood ooze hair he knock
2,right say lupin suddenly businesslike ron I mend bone nearly well madam pomfrey I think good strap leg get hospital wing he hurry ron bent tap ron leg wand mutter ferula bandage spin ron leg strap tightly splint lupin help foot ron put weight gingerly leg wince that well say
2,er perhaps good revive safely back castle we take like he mutter mobilicorpus as though invisible string tie snape wrist neck knee pull standing position head still loll unpleasantly like grotesque puppet he hang inch ground limp foot dangle lupin pick invisibility cloak tuck safely pocket
2,there bang burst light ron lie motionless grind another bang crookshank fly air back earth heap expelliarmus harry yelled point wand pettigrew lupin wand fly high air sight stay harry shout run forwards too late
2,I go live godfather I leave dursley he force think sirius sirius begin chant expecto patronum expecto patronum black give shudder roll lie motionless ground pale death
2,I leave dursley he force think sirius sirius begin chant expecto patronum expecto patronum black give shudder roll lie motionless ground pale death he right
2,he right I going go live expecto patronum hermione help expecto patronum
2,expecto patronum hermione help expecto patronum expecto hermione whisper expecto expecto but
2,hermione help expecto patronum expecto hermione whisper expecto expecto but the dementor close barely ten foot
2,the dementor close barely ten foot they form solid wall around harry hermione get close expecto patronum harry yelled try blot scream ear expecto patronum a thin wisp silver escape wand hover like mist
2,they form solid wall around harry hermione get close expecto patronum harry yelled try blot scream ear expecto patronum a thin wisp silver escape wand hover like mist at moment harry feel hermione collapse next
2,at moment harry feel hermione collapse next he alone completely alone expecto expecto patronum harry feel knee hit cold grass fog cloud eye
2,fog cloud eye with huge effort fight remember sirius innocent innocent ok I go live expecto patronum gasp by feeble light formless patronus saw dementor halt close it walk cloud silver mist harry conjure
2,it make gesture though sweep patronus aside no harry gasp he innocent expecto expecto patronum he could feel watching hear rattle breath like evil wind around the near dementor seem consider
2,his patronus flickered die white fog blinding he fight expecto patronum see distance hear familiar scream expecto patronum grope mist sirius find arm go take but pair strong clammy hand suddenly wrap around harry neck they force face upwards could feel breath going get rid first could feel putrid breath mother scream ear go last thing ever hear
2,minister listen please hermione say hurried harry side gaze imploringly fudge face I see it ron rat animagus pettigrew I mean you see minister say snape confunde black do good job
2,he see father see harry flung behind bush pull wand expecto patronum yell and end wand burst shapeless cloud mist blind dazzle silver animal he screw eye trying see
2,he leapt chair hurried window try open locked stand back hermione call take wand still grip back harry robe leave hand alohomora the window spring open how say black weakly stare hippogriff
3,nevertheless sirius help harry even it due sirius harry school thing bedroom the dursley never allow general wish keep harry miserable possible coupled fear power lead lock school trunk cupboard stair every summer prior but attitude change since find harry dangerous murderer godfather harry conveniently forget tell sirius innocent harry receive two letter sirius since back privet drive
3,he push sleeve robe take wand harry see dursley draw back wall one incendio say mr weasley point wand hole wall behind flame rise fireplace crackling merrily though burn hour mr weasley take small drawstre bag pocket untie take pinch powder inside throw onto flame turn emerald green roar higher ever
3,nothing don lie mrs weasley point wand george pocket say accio several small brightly colored object zoom george pocket make grab miss speed right mrs weasley outstretche hand we tell destroy say mrs weasley furiously hold unmistakably tontongue toffee
3,empty pocket go it unpleasant scene twin evidently try smuggle many toffee house possible use summon charm mrs weasley manage find accio accio accio shout toffee zoom sort unlikely place include line george jacket turnup fre jean
3,it unpleasant scene twin evidently try smuggle many toffee house possible use summon charm mrs weasley manage find accio accio accio shout toffee zoom sort unlikely place include line george jacket turnup fre jean we spend six month develop fred shout mother throw toffee away
3,accio accio accio shout toffee zoom sort unlikely place include line george jacket turnup fre jean we spend six month develop fred shout mother throw toffee away oh fine way spend six month shriek
3,like big party at moment wizard plusfour appear thin air next mr roberts front door obliviate say sharply point wand mr roberts instantly mr roberts eye slide focus brow unknitted look dreamy unconcern fall face harry recognize symptom one memory modify
3,minister ready go ready ludo say fudge comfortably ludo whip wand direct throat say sonorus speak roar sound fill pack stadium voice echo boom every corner stand lady gentleman welcome welcome final four hundred twentysecond quidditch world cup
3,but grin happily troy quigley lift cup air crowd thunder approval harry hands numb clapping at last irish team leave box perform another lap honor broom aidan lynch back connolly clutch hard around waist still grin bemused sort way bagman point wand throat mutter quietus they talk one year say hoarsely really unexpected twist shame last long
3,what happen say hermione anxiously stop abruptly harry walk ron oh stupid lumo she illuminate wand direct narrow beam across path ron lie sprawl ground
3,who say and without warn silence rent voice unlike hear wood utter panicked shout sound like spell morsmordre and something vast green glittering erupt patch darkness harry eye struggle penetrate flew treetops sky what gasp ron sprang foot stare thing appear
3,without pause think yelled duck he seize two pull onto ground stupefy roar twenty voice blind series flash harry feel hair head ripple though powerful wind sweep clearing raise head fraction inch see jet fiery red light fly wizard wand cross one another bounce tree trunk rebound darkness stop yelled voice recognize
3,if right mr crouch I think hear get say crouch give sign hear mr diggory mr diggory seem take silence assent he raise wand point winky say rennervate winky stir feebly her great brown eye open blink several time bemuse sort way
3,there simple way discover last spell wand perform elf know winky tremble shake head frantically ear flap mr diggory raise wand place tip tip harry prior incantato roar mr diggory harry hear hermione gasp horrify gigantic serpenttongue skull erupt point two wand meet mere shadow green skull high look though make thick gray smoke ghost spell deletrius mr diggory shout smoky skull vanish wisp smoke
3,prior incantato roar mr diggory harry hear hermione gasp horrify gigantic serpenttongue skull erupt point two wand meet mere shadow green skull high look though make thick gray smoke ghost spell deletrius mr diggory shout smoky skull vanish wisp smoke so say mr diggory kind savage triumph look upon winky still shake convulsively I squeal eye roll terror
3,laugh malfoy beckon crabbe goyle three disappear ron get foot slam slide compartment door hard behind glass shatter ron say hermione reproachfully pull wand mutter reparo glass shard fly back single pane back door well make look like know everything ron snarl
3,harry feel ron recoil slightly next ron hate spider moody reach jar catch one spider hold palm hand could see he point wand mutter imperio the spider leapt moody hand fine thread silk begin swe backward forward though trapeze it stretch leg rigidly back flip break thread landing desk begin cartwheel circle
3,the cruciatus curse say moody need bit big get idea say point wand spider engorgio the spider swell it large tarantula
3,it large tarantula abandon pretense ron push chair backward far away moody desk possible moody raise wand point spider mutter crucio at spider leg bend upon body roll begin twitch horribly rock side side no sound come harry sure could give voice would scream
3,moody raise wand the spider leg relax continued twitch reducio moody mutter spider shrink back proper size he put back jar pain say moody softly
3,hermione hand shake slightly third time raise air yes say moody look avada kedavra hermione whisper several people look uneasily around include ron ah say moody another slight smile twist lopsided mouth
3,ah say moody another slight smile twist lopsided mouth yes last bad avada kedavra kill curse he put hand glass jar almost though know come third spider scuttle frantically around bottom jar try evade moody finger trap place upon desktop it start scuttle frantically across wooden surface
