book_num,paragraph
3,it start scuttle frantically across wooden surface moody raise wand harry feel sudden thrill foreboding avada kedavra moody roar there flash blind green light rush sound though vast invisible something soar air instantaneously spider roll onto back unmarked unmistakably dead several student stifle cry ron throw backward almost topple seat spider skid toward
3,moody speak great distance seem harry with massive effort pull back present listen moody say avada kedavra curse need powerful bit magic behind could get wand point say word I doubt I get much nosebleed but matter I teach
3,you want find situation face constant vigilance roar whole class jump now three curse avada kedavra imperius cruciatus know unforgivable curse the use one fellow human enough earn life sentence azkaban that
3,fred george right he really know stuff moody when avada kedavra way spider die snuff right but ron fall suddenly silent look harry face speak reach great hall said suppose well make start professor trelawney prediction tonight since would take hour hermione join harry ron conversation dinner eat furiously fast left library
3,potter moody growl next harry move forward middle classroom space moody clear desk moody raise wand point harry say imperio it wonderful feeling harry feel float sensation every think worry head wipe gently away leave nothing vague untraceable happiness
3,moody look get gut for split second look eye exactly time act furnunculus harry yelled densaugeo scream malfoy jet light shoot wand hit midair ricochet angle harry hit goyle face malfoy hit hermione
3,for split second look eye exactly time act furnunculus harry yelled densaugeo scream malfoy jet light shoot wand hit midair ricochet angle harry hit goyle face malfoy hit hermione goyle bellow put hand nose great ugly boil spring hermione whimpering panic clutch mouth
3,yes say mr ollivander yes I never use veela hair course I find make rather temperamental wand however suit mr ollivander run finger along wand apparently check scratch bump mutter orchideous bunch flower burst wand tip very well well fine working order say mr ollivander scoop flower hand fleur wand mr
3,he lift wand examine minutely turn eye yes hornbeam dragon heartstre shot krum nod rather thick one usually see quite rigid ten quarter inch avi the hornbeam wand let blast like gun number small twittering bird fly end open window watery sunlight good say mr ollivander handing krum back wand
3,stunning spell count three harry saw dragon keeper pull wand stupefy shout unison stunning spell shoot darkness like fiery rocket burst shower star dragons scaly hide harry watch dragon near teeter dangerously back leg jaw stretch wide silent howl nostril suddenly devoid flame though still smoke slowly fall several ton sinewy scalyblack dragon hit ground thud harry could swear make tree behind quake
3,this give harry idea pausing distance pull wand take careful aim diffindo cedric bag split parchment quill book spill onto floor
3,well know next time I manage spell harry say throw rune dictionary back hermione could try threaten dragon right he raise wand accio dictionary the heavy book soar hermione hand fly across room harry catch harry I really think get say hermione delightedly
3,he raise wand accio firebolt shout harry wait every fiber hope pray if work come he seem look everything around sort shimmer transparent barrier like heat haze make enclosure hundred face around swim strangely
3,mine snape reach horrible expression dawn comprehension face accio parchment the map fly air slip snape outstretche finger soar stairs moody hand my mistake moody say calmly
3,she seem take library lack useful information subject personal insult never fail I know I done say harry rest facedown saucy trick tricky sort I learn animagus like sirius an animagus wizard could transform animal yeah could turn goldfish time want say ron
3,I know I done say harry rest facedown saucy trick tricky sort I learn animagus like sirius an animagus wizard could transform animal yeah could turn goldfish time want say ron or frog yawned harry
3,or frog yawned harry he exhaust it take year become animagus register everything say hermione vaguely squint index weird wizarde dilemma their solution professor mcgonagall tell we remember get register improper use magic office animal become marking abuse
3,he would grab invisibility cloak go back library stay night lumos harry whisper fifteen minute later open library door wand tip alight creep along bookshelf pull book book hex charm book merpeople water monster book famous witch wizard magical invention anything might include one pass reference underwater survival he carry table set work search narrow beam wand occasionally check watch
3,know go yeah harry pant massaging rib bagman give harry shoulder quick squeeze return judge table point wand throat do world cup say sonorus voice boom across dark water toward stand well champion ready second task start whistle they precisely hour recover take
3,harry twisted body around see grindylow small horn water demon poking weed long finger clutch tightly around harry leg point fang bare harry stuck web hand quickly inside robe fumble wand by time grasp two grindylow risen weed seize handfuls harry robe attempt drag relashio harry shout except sound come a large bubble issue mouth wand instead send spark grindylow pelt seemed jet boiling water strike angry red patch appear green skin harry pull ankle grindylow grip swam fast could occasionally send jet hot water shoulder random every feel one grindylow snatch foot kick hard finally feel foot connect horn skull look back see daze grindylow float away crosseye fellow shake fist harry sink back weed
3,for nearly half hour climb steep wind stony path follow sirius wag tail sweat sun shoulder straps harry bag cutting shoulder then last sirius slip sight reach place vanish see narrow fissure rock they squeeze find cool dimly light cave tethered end one end rope around large rock buckbeak hippogriff half gray horse half giant eagle buckbeak fierce orange eye flash sight
3,his black hair long appear fire untidy mat he look thin chicken say hoarsely remove old daily prophet mouth throw onto cave floor harry pull open bag hand bundle chicken leg bread thank say sirius opening grab drumstick sit cave floor tear large chunk tooth
3,chicken say hoarsely remove old daily prophet mouth throw onto cave floor harry pull open bag hand bundle chicken leg bread thank say sirius opening grab drumstick sit cave floor tear large chunk tooth I live rat mostly can steal much food hogsmeade I draw attention
3,your last letter well let say thing get fishier I steal paper every time someone throw one look thing I one getting worried he nod yellow daily prophet cave floor ron pick unfold harry however continue stare sirius what catch
3,what catch what see you three dumbledore one around know I animagus say sirius shrug continue devour chicken leg ron nudge harry pass daily prophet there two the first bore headline mystery illness bartemius crouch second ministry witch still miss minister magic now personally involve
3,crouch sack houseelf yeah quidditch world cup say harry launch story dark mark appearance winky find harry wand clutched hand mr crouch fury when harry finish sirius foot start pace cave let get straight say brandish fresh chicken leg you first see elf top box
3,no say harry I think say busy sirius pace around cave silence then say harry check pocket wand leave top box erm harry think hard
3,load people say harry some bulgarian minister cornelius fudge malfoy the malfoy say ron suddenly loudly voice echo around cave buckbeak toss head nervously I bet lucius malfoy anyone else say sirius
3,a grin flash across sirius thin face all right I try he walk cave back say imagine voldemort powerful you know supporter know work know control people terrible thing without able stop you scare family friend
3,he run finger distractedly filthy hair shrug well I idea karkaroff genuinely worry go snape answer sirius stare cave wall make grimace frustration there still fact dumbledore trust snape I know dumbledore trust lot people I see let snape teach hogwart ever work voldemort why moody crouch keen get snape office say ron stubbornly
3,what world cup important turn top box what judge tournament sirius lapse silence still stare cave wall buckbeak ferreting around rocky floor look bone might overlook finally sirius look ron
3,he hand harry empty napkin flask go pat buckbeak goodbye I walk edge village say sirius see I scrounge another paper he transform great black dog leave cave walk back mountainside across boulderstrewn ground back stile here allow pat head turn setting run around outskirt village harry ron hermione make way back hogsmeade toward hogwart
3,hermione however ask harry ron help pursue vengeance rita skeeter grateful workload mount ever high day easter holiday harry frankly marvel fact hermione could research magical method eavesdrop well everything else he work flatout get homework though make point send regular food package cave mountain sirius last summer harry forget feel like continually hungry he enclose note sirius tell nothing ordinary happen still wait answer percy hedwig return end easter holiday
3,they definitely somewhere around lumos dumbledore say lighting wand hold its narrow beam travel black trunk black trunk illuminate ground and fall upon pair foot
3,he raise wand air point direction hagrid cabin harry see something silvery dart streak away tree like ghostly bird then dumbledore bent krum pointed wand mutter rennervate krum open eye he looked daze
3,the tip wand emerge around back chair it point wormtail crucio say cold voice wormtail scream scream though every nerve body fire scream fill harry ears scar forehead sear pain yell voldemort would hear would know
3,you sirius correspondent say dumbledore I also contact ever since leave hogwart last year it I suggest mountainside cave safe place stay dumbledore get begin walk behind desk every place wand tip temple remove another shine silver think add pensieve
3,off go say bagman brightly four patroller good luck harry hagrid whisper four walk away different direction station around maze bagman point wand throat mutter sonorus magically magnify voice echo stand lady gentleman third final task triwizard tournament begin let remind point currently stand
3,the tower hedge cast black shadow across path whether tall thick enchanted sound surround crowd silence moment enter maze harry feel almost though underwater he pull wand mutter lumos hear cedric behind after fifty yard reach fork they look
3,harry could hear rattle breath feel clammy coldness stealing know he summon happy thought could concentrated might think get maze celebrate ron hermione raise wand cry expecto patronum a silver stag erupt end harry wand gallop toward dementor fall back trip hem robe harry never see dementor stumble
3,hang shout advance wake silver patronus you boggart riddikulus there loud crack shapeshifter explode wisp smoke the silver stag fade sight
3,this look like kind enchantment he wonder whether might able blast way reducto say the spell shoot straight mist leave intact he suppose know well reductor curse solid object
3,its long sting curl back its thick armor glint light harry wand point stupefy the spell hit skrewt armor rebound harry ducked time could smell burn hair singe top head the skrewt issue blast fire end fly forward toward
3,the spell hit skrewt armor rebound harry ducked time could smell burn hair singe top head the skrewt issue blast fire end fly forward toward impedimenta harry yell the spell hit skrewt armor ricochet harry stagger back pace fall impedimenta
3,impedimenta harry yell the spell hit skrewt armor ricochet harry stagger back pace fall impedimenta the skrewt inch freeze manage hit fleshy shellless underside pant harry push away run hard opposite direction impediment curse permanent skrewt would regain use leg moment
3,what hell think and harry hear krum voice crucio the air suddenly full cedric yell horrify harry begin sprint path try find way cedric
3,harry pull pointed wand krum krum look krum turn begin run stupefy harry yell the spell hit krum back stop dead track fall forward lie motionless facedown grass harry dash cedric stop twitch lie pant hand face
3,cedric look around time hurl past thing avoid collide haste trip harry see cedric wand fly hand gigantic spider step path begin bear upon cedric stupefy harry yelled spell hit spider gigantic hairy black body good might well throw stone spider jerk scuttle around run harry instead stupefy impedimenta
3,harry see cedric wand fly hand gigantic spider step path begin bear upon cedric stupefy harry yelled spell hit spider gigantic hairy black body good might well throw stone spider jerk scuttle around run harry instead stupefy impedimenta stupefy
3,stupefy harry yelled spell hit spider gigantic hairy black body good might well throw stone spider jerk scuttle around run harry instead stupefy impedimenta stupefy but use spider either large magical spell aggravate
3,stupefy impedimenta stupefy but use spider either large magical spell aggravate harry one horrify glimpse eight shine black eye razorsharp pincer upon
3,harry one horrify glimpse eight shine black eye razorsharp pincer upon he lift air front leg struggle madly try kick leg connect pincer next moment excruciating pain he could hear cedric yell stupefy spell effect harry harry raised wand spider open pincer shout expelliarmus it work disarm spell make spider drop mean harry fall twelve foot onto already injure leg crumple beneath without pause think aim high spider underbelly do skrewt shout stupefy cedric yelled thing
3,he could hear cedric yell stupefy spell effect harry harry raised wand spider open pincer shout expelliarmus it work disarm spell make spider drop mean harry fall twelve foot onto already injure leg crumple beneath without pause think aim high spider underbelly do skrewt shout stupefy cedric yelled thing the two spell combine one alone the spider keel sideways flatten nearby hedge strew path tangle hairy leg harry hear cedric shouting
3,it agony never feel life wand slip finger put hand face knee buckled ground could see nothing head split open from far away head hear high cold voice say kill spare a swishing noise second voice screech word night avada kedavra a blast green light blaze harry eyelid hear something heavy fall ground beside pain scar reach pitch retch diminish terrified see open sting eye cedric lie spreadeagle ground beside
3,voldemort begin laugh he raise wand crucio the death eater ground writhe shriek harry sure sound must carry house around let police come think desperately anyone anything
3,voldemort move slowly forward turn face harry he raise wand crucio it pain beyond anything harry ever experience bone fire head surely split along scar eye roll madly head want end black die and go
3,now untie wormtail give back wand chapter 34 priori incantatem wormtail approach harry scramble find foot support weight rope untie wormtail raise new silver hand pull wad material gag harry one swipe cut bond tie harry gravestone
3,you teach duel harry potter say voldemort softly red eye glint darkness at word harry remember though former life duel club hogwart attend briefly two year ago all learn disarm spell expelliarmus use would deprive voldemort wand even could surround death eater outnumber least thirty one he never learn anything could possibly fit he know face thing moody always warn unblockable avada kedavra curse voldemort right mother die time
3,all learn disarm spell expelliarmus use would deprive voldemort wand even could surround death eater outnumber least thirty one he never learn anything could possibly fit he know face thing moody always warn unblockable avada kedavra curse voldemort right mother die time he quite unprotecte
3,I ask whether want say voldemort softly answer imperio and harry feel third time life sensation mind wipe think ah bliss think though float dream answer say answer
3,before voldemort could stick snakelike face around headstone harry stand grip wand tightly hand thrust front throw around headstone face voldemort voldemort ready as harry shout expelliarmus voldemort cry avada kedavra a jet green light issue voldemort wand jet red light blast harry meet midair suddenly harry wand vibrate though electric charge surge hand seize around release want narrow beam light connect two wand neither red green bright deep gold harry follow beam astonish gaze see voldemort long white finger grip wand shake vibrate
3,ten foot cedric harry dive behind marble angel avoid jet red light see tip wing shatter spell hit grip wand tightly dash behind angel impedimenta bellow point wand wildly shoulder death eater run from muffled yell think stop least one time stop look jump cup dive hear wand blast behind jet light flew head fall stretch hand grab cedric arm stand aside
3,voldemort red eye flame darkness harry see mouth curl smile see raise wand accio harry yelled point wand triwizard cup it fly air soar toward harry catch handle
3,he back harry potter conquer I conquer moody raise wand open mouth harry plunge hand robe stupefy there blind flash red light great splintering crash door moody office blast apart moody throw backward onto office floor harry still stare place moody face see albus dumbledore professor snape professor mcgonagall look back foeglass
3,winky remain knee tremble hand face dumbledore force man mouth open pour three drop inside then point wand man chest say rennervate crouch son open eye his face slack gaze unfocused
3,why harry look dumbledore whose face arrest look priori incantatem mutter his eye gaze harry almost though invisible beam understanding shoot the reverse spell effect say sirius sharply
3,but say work oh electronic bug say hermione no see rita skeeter hermione voice tremble quiet triumph unregistere animagus she turn hermione pull small sealed glass jar bag
3,he wand george careful tread malfoy follow fred inside interesting effect say george look crabbe who use furnunculus curse I say harry odd say george lightly
3,the maze grow darker every pass minute sky overhead deepen navy he reach second fork point I whisper wand hold flat palm the wand spin around point toward right solid hedge that way north know need go northwest center maze
3,harry broke run he choice path ahead point I whisper wand spin around pointed righthand one he dash one see light ahead the triwizard cup gleam plinth hundred yard away
4,whatever you do keep your mouth shut wand harry mutter frantically hand fly ground like spider where wand come lumo he say spell automatically desperate light help search disbelieving relief light flare inch right hand wand tip ignite harry snatch scramble foot turn around
4,a tower hooded figure glide smoothly toward hover ground foot face visible beneath robe suck night came stumble backward harry raise wand expecto patronum a silvery wisp vapor shoot tip wand dementor slow spell work properly trip foot harry retreat farther dementor bore upon panic fog brain concentrate a pair gray slimy scabbe hand slide inside dementor robe reach
4,a pair gray slimy scabbe hand slide inside dementor robe reach a rush noise fill harry ears expecto patronum his voice sound dim distant another wisp silver smoke feebler last drifted wand anymore work spell
4,he never go see ron hermione and face burst clearly mind fight breath expecto patronum an enormous silver stag erupt tip harry wand antler catch dementor place heart throw backward weightless darkness stag charge dementor swoop away batlike defeat this way harry shout stag
4,be why stand dark say third voice one completely unfamiliar woman lumo a wand tip flare illuminate hall magical light harry blink
4,she flick wand hopefully one harry sock give feeble sort wiggle flop back top mess within ah well say tonk slam trunk lid shut least that could bit cleaning scourgify she point wand hedwig cage feather dropping vanish well bit well I never quite get hang sort householdy spell right get everything
4,both buttock still okay let go locomotor trunk harry trunk rise inch air hold wand like conductor baton tonk make hover across room door ahead hedwig cage leave hand
4,she snatch plan table stuff bill heavily laden arm this sort thing ought clear away promptly end meeting snap sweep toward ancient dresser start unload dinner plate bill take wand mutter evanesco scroll vanish sit harry say sirius you meet mundungus
4,see old figgy since ask no said harry I see anyone see I ave left say mundungus lean forward plead note voice I ad business opportunity harry feel something brush knee start crookshank hermione bandylegge ginger cat wind around harry leg purr jump onto sirius lap curl sirius scratch absentmindedly behind ear turn still grimface harry
4,I stick inside month how come ask harry frown because ministry magic still voldemort know animagus wormtail tell big disguise useless there much I order phoenix dumbledore feel there something slightly flatten tone voice sirius utter dumbledore name tell harry sirius happy headmaster either
4,yes like kind weapon say harry something bad avada kedavra that enough mrs weasley speak shadow beside door
4,what reckon say harry could anything say fred but anything bad avada kedavra curse say ron what bad death maybe something kill load people suggest george
4,mr weasley body replace bill glass askew trickle blood run face no mrs weasley moan no riddikulus riddikulus riddikulus
4,no mrs weasley moan no riddikulus riddikulus riddikulus crack
4,no riddikulus riddikulus riddikulus crack dead twin
4,lupin come running room closely follow sirius moody stumping along behind lupin look mrs weasley dead harry floor seem understand instant pull wand say firmly clearly riddikulus harry body vanish a silvery orb hung air spot lain
4,never mind say ginny bracingly look get rid easily she pull wand scourgify the stinksap vanish sorry say neville small voice
4,I know potter mean mess utterly worthless evanesco the content harry potion vanish leave stand foolishly beside empty cauldron those manage read instruction fill one flagon sample potion label clearly name bring desk testing say snape
4,she fold half newspaper thoughtfully when harry laid knife fork seem come reverie right well I think tackle essay sprout selffertilize shrub first lucky able start mcgonagall inanimatus conjurus lunch harry feel small twinge guilt think pile homework await upstairs sky clear exhilarate blue firebolt week
4,they spend whole sunday common room bury book room around fill empty it another clear fine day fellow gryffindor spend day ground enjoy might well last sunshine year by evening harry feel though somebody beat brain inside skull you know probably try get homework do week harry muttered ron finally lay aside professor mcgonagall long essay inanimatus conjurus spell turn miserably professor sinistra equally long difficult essay jupiter moon yeah say ron rub slightly bloodshot eye throw fifth spoiled bit parchment fire beside listen shall ask hermione look do
4,he indicate smash bowl floor ron nod leave reparo harry mutter point wand break piece china they fly back together good new return murtlap essence bowl he suddenly tired tempt sink back armchair sleep instead get foot follow ron upstairs
4,hey idea say ron excitedly hermione make skeptical noise three look sirius head turn flame well sirius four meeting shriek shack school say hermione could transform animal I suppose could squeeze single invisibility cloak want but twentyeight we none we animagus need much invisibility cloak invisibility marquee fair point say sirius look slightly crestfallen well I sure come somewhere
4,I almost certain say hermione grimly watch frog escape harry pointed wand bullfrog hop hopefully toward side table accio zoom gloomily back hand charm always one good lesson enjoy private chat there generally much movement activity danger overhear slight today room full croak bullfrog cawing raven heavy downpour rain clatter pound classroom windows harry ron hermione whisper discussion umbridge nearly catch sirius go quite unnoticed
4,it close call last night say hermione I wonder umbridge know close silencio the bullfrog practice silence charm strike dumb midcroak glare reproachfully if catch snuffle
4,harry finished sentence he probably back azkaban morning he wave wand without really concentrate bullfrog swell like green balloon emit highpitche whistle silencio say hermione hastily point wand harry frog deflate silently well I know going let know
4,I reckon risk say ron he stupid know nearly get silencio the large ugly raven front let derisive caw silencio
4,silencio the large ugly raven front let derisive caw silencio silencio the raven caw loudly
4,the large ugly raven front let derisive caw silencio silencio the raven caw loudly it way move wand say hermione watch ron critically
4,raven hard frog say ron testily fine let swap say hermione seize ron raven replace fat bullfrog silencio the raven continue open close sharp beak sound come very good miss granger say professor flitwick squeaky little voice harry ron hermione jump now let see try mr weasley
4,wha oh oh right say ron fluster er silencio he jab bullfrog hard poke eye frog give deafen croak leapt desk it come surprise harry ron give additional practice silence charm homework
4,harry something glass stop rain fog play hufflepuff storm hermione say harry he pull wand tap glass say impervius I think ought try say angelina if could keep rain face would really help visibility together come impervius
4,he pull wand tap glass say impervius I think ought try say angelina if could keep rain face would really help visibility together come impervius okay let go
